Trial 26 finished with value: 0.7631578947368421 and parameters: {'momentum': 0.8839270551219995}. Best is trial 12 with value: 0.9736842105263158.
Trial 27 finished with value: 0.9736842105263158 and parameters: {'momentum': 0.9887545050398467}. Best is trial 27 with value: 0.9736842105263158.
Trial 28 finished with value: 0.6052631578947368 and parameters: {'momentum': 0.8104918434458502}. Best is trial 27 with value: 0.9736842105263158.
Trial 29 finished with value: 0.7894736842105263 and parameters: {'momentum': 0.8966504740666983}. Best is trial 27 with value: 0.9736842105263158.
84210526316 and parameters: {'momentum': 0.3067986499189541}. Best is trial 1 with value: 0.868421052631579.
Trial 5 finished with value: 0.5789473684210527 and parameters: {'momentum': 0.5027304944198423}. Best is trial 1 with value: 0.868421052631579.
Trial 6 finished with value: 0.5 and parameters: {'momentum': 0.35407528476620276}. Best is trial 1 with value: 0.868421052631579.
Trial 7 finished with value: 0.5789473684210527 and parameters: {'momentum': 0.7845717468291608}. Best is trial 1 with value: 0.868421052631579.
Trial 8 finished with value: 0.23684210526315788 and parameters: {'momentum': 0.11950547138775147}. Best is trial 1 with value: 0.868421052631579.
Trial 9 finished with value: 0.23684210526315788 and parameters: {'momentum': 0.11064609416531002}. Best is trial 1 with value: 0.868421052631579.
Trial 10 finished with value: 0.8947368421052632 and parameters: {'momentum': 0.9345689933872496}. Best is trial 10 with value: 0.8947368421052632.
Trial 11 finished with value: 0.9473684210526315 and parameters: {'momentum': 0.9668857072541637}. Best is trial 11 with value: 0.9473684210526315.
Trial 12 finished with value: 0.9736842105263158 and parameters: {'momentum': 0.9866805172498223}. Best is trial 12 with value: 0.9736842105263158.
Trial 13 finished with value: 0.5789473684210527 and parameters: {'momentum': 0.7512445222870912}. Best is trial 12 with value: 0.9736842105263158.
Trial 14 finished with value: 0.5789473684210527 and parameters: {'momentum': 0.7579903663952012}. Best is trial 12 with value: 0.9736842105263158.
Trial 15 finished with value: 0.9473684210526315 and parameters: {'momentum': 0.9599449532382308}. Best is trial 12 with value: 0.9736842105263158.
Trial 16 finished with value: 0.5789473684210527 and parameters: {'momentum': 0.6406057467785957}. Best is trial 12 with value: 0.9736842105263158.
Trial 17 finished with value: 0.6842105263157895 and parameters: {'momentum': 0.8465535973043425}. Best is trial 12 with value: 0.9736842105263158.
Trial 18 finished with value: 0.9736842105263158 and parameters: {'momentum': 0.9975536620250329}. Best is trial 12 with value: 0.9736842105263158.
Trial 19 finished with value: 0.5789473684210527 and parameters: {'momentum': 0.6342331714736982}. Best is trial 12 with value: 0.9736842105263158.
Trial 20 finished with value: 0.5789473684210527 and parameters: {'momentum': 0.6245382660245355}. Best is trial 12 with value: 0.9736842105263158.
Trial 21 finished with value: 0.9736842105263158 and parameters: {'momentum': 0.9910833366471181}. Best is trial 12 with value: 0.9736842105263158.
Trial 22 finished with value: 0.6842105263157895 and parameters: {'momentum': 0.8511989216863185}. Best is trial 12 with value: 0.9736842105263158.
Trial 23 finished with value: 0.7105263157894737 and parameters: {'momentum': 0.8651430221657904}. Best is trial 12 with value: 0.9736842105263158.
Trial 24 finished with value: 0.9736842105263158 and parameters: {'momentum': 0.9861195378303332}. Best is trial 12 with value: 0.9736842105263158.
Trial 25 finished with value: 0.5789473684210527 and parameters: {'momentum': 0.7038643885831284}. Best is trial 12 with value: 0.9736842105263158.
Trial 26 finished with value: 0.7631578947368421 and parameters: {'momentum': 0.8839270551219995}. Best is trial 12 with value: 0.9736842105263158.
Trial 27 finished with value: 0.9736842105263158 and parameters: {'momentum': 0.9887545050398467}. Best is trial 27 with value: 0.9736842105263158.
Trial 28 finished with value: 0.6052631578947368 and parameters: {'momentum': 0.8104918434458502}. Best is trial 27 with value: 0.9736842105263158.
Trial 29 finished with value: 0.7894736842105263 and parameters: {'momentum': 0.8966504740666983}. Best is trial 27 with value: 0.9736842105263158.
9.
Trial 5 finished with value: 0.5789473684210527 and parameters: {'momentum': 0.5027304944198423}. Best is trial 1 with value: 0.868421052631579.
Trial 6 finished with value: 0.5 and parameters: {'momentum': 0.35407528476620276}. Best is trial 1 with value: 0.868421052631579.
Trial 7 finished with value: 0.5789473684210527 and parameters: {'momentum': 0.7845717468291608}. Best is trial 1 with value: 0.868421052631579.
Trial 8 finished with value: 0.23684210526315788 and parameters: {'momentum': 0.11950547138775147}. Best is trial 1 with value: 0.868421052631579.
Trial 9 finished with value: 0.23684210526315788 and parameters: {'momentum': 0.11064609416531002}. Best is trial 1 with value: 0.868421052631579.
Trial 10 finished with value: 0.8947368421052632 and parameters: {'momentum': 0.9345689933872496}. Best is trial 10 with value: 0.8947368421052632.
Trial 11 finished with value: 0.9473684210526315 and parameters: {'momentum': 0.9668857072541637}. Best is trial 11 with value: 0.9473684210526315.
Trial 12 finished with value: 0.9736842105263158 and parameters: {'momentum': 0.9866805172498223}. Best is trial 12 with value: 0.9736842105263158.
Trial 13 finished with value: 0.5789473684210527 and parameters: {'momentum': 0.7512445222870912}. Best is trial 12 with value: 0.9736842105263158.
Trial 14 finished with value: 0.5789473684210527 and parameters: {'momentum': 0.7579903663952012}. Best is trial 12 with value: 0.9736842105263158.
Trial 15 finished with value: 0.9473684210526315 and parameters: {'momentum': 0.9599449532382308}. Best is trial 12 with value: 0.9736842105263158.
Trial 16 finished with value: 0.5789473684210527 and parameters: {'momentum': 0.6406057467785957}. Best is trial 12 with value: 0.9736842105263158.
Trial 17 finished with value: 0.6842105263157895 and parameters: {'momentum': 0.8465535973043425}. Best is trial 12 with value: 0.9736842105263158.
Trial 18 finished with value: 0.9736842105263158 and parameters: {'momentum': 0.9975536620250329}. Best is trial 12 with value: 0.9736842105263158.
Trial 19 finished with value: 0.5789473684210527 and parameters: {'momentum': 0.6342331714736982}. Best is trial 12 with value: 0.9736842105263158.
Trial 20 finished with value: 0.5789473684210527 and parameters: {'momentum': 0.6245382660245355}. Best is trial 12 with value: 0.9736842105263158.
Trial 21 finished with value: 0.9736842105263158 and parameters: {'momentum': 0.9910833366471181}. Best is trial 12 with value: 0.9736842105263158.
Trial 22 finished with value: 0.6842105263157895 and parameters: {'momentum': 0.8511989216863185}. Best is trial 12 with value: 0.9736842105263158.
Trial 23 finished with value: 0.7105263157894737 and parameters: {'momentum': 0.8651430221657904}. Best is trial 12 with value: 0.9736842105263158.
Trial 24 finished with value: 0.9736842105263158 and parameters: {'momentum': 0.9861195378303332}. Best is trial 12 with value: 0.9736842105263158.
Trial 25 finished with value: 0.5789473684210527 and parameters: {'momentum': 0.7038643885831284}. Best is trial 12 with value: 0.9736842105263158.
Trial 26 finished with value: 0.7631578947368421 and parameters: {'momentum': 0.8839270551219995}. Best is trial 12 with value: 0.9736842105263158.
Trial 27 finished with value: 0.9736842105263158 and parameters: {'momentum': 0.9887545050398467}. Best is trial 27 with value: 0.9736842105263158.
Trial 28 finished with value: 0.6052631578947368 and parameters: {'momentum': 0.8104918434458502}. Best is trial 27 with value: 0.9736842105263158.
Trial 29 finished with value: 0.7894736842105263 and parameters: {'momentum': 0.8966504740666983}. Best is trial 27 with value: 0.9736842105263158.
s: {'momentum': 0.5027304944198423}. Best is trial 1 with value: 0.868421052631579.
Trial 6 finished with value: 0.5 and parameters: {'momentum': 0.35407528476620276}. Best is trial 1 with value: 0.868421052631579.
Trial 7 finished with value: 0.5789473684210527 and parameters: {'momentum': 0.7845717468291608}. Best is trial 1 with value: 0.868421052631579.
Trial 8 finished with value: 0.23684210526315788 and parameters: {'momentum': 0.11950547138775147}. Best is trial 1 with value: 0.868421052631579.
Trial 9 finished with value: 0.23684210526315788 and parameters: {'momentum': 0.11064609416531002}. Best is trial 1 with value: 0.868421052631579.
Trial 10 finished with value: 0.8947368421052632 and parameters: {'momentum': 0.9345689933872496}. Best is trial 10 with value: 0.8947368421052632.
Trial 11 finished with value: 0.9473684210526315 and parameters: {'momentum': 0.9668857072541637}. Best is trial 11 with value: 0.9473684210526315.
Trial 12 finished with value: 0.9736842105263158 and parameters: {'momentum': 0.9866805172498223}. Best is trial 12 with value: 0.9736842105263158.
Trial 13 finished with value: 0.5789473684210527 and parameters: {'momentum': 0.7512445222870912}. Best is trial 12 with value: 0.9736842105263158.
Trial 14 finished with value: 0.5789473684210527 and parameters: {'momentum': 0.7579903663952012}. Best is trial 12 with value: 0.9736842105263158.
Trial 15 finished with value: 0.9473684210526315 and parameters: {'momentum': 0.9599449532382308}. Best is trial 12 with value: 0.9736842105263158.
Trial 16 finished with value: 0.5789473684210527 and parameters: {'momentum': 0.6406057467785957}. Best is trial 12 with value: 0.9736842105263158.
Trial 17 finished with value: 0.6842105263157895 and parameters: {'momentum': 0.8465535973043425}. Best is trial 12 with value: 0.9736842105263158.
Trial 18 finished with value: 0.9736842105263158 and parameters: {'momentum': 0.9975536620250329}. Best is trial 12 with value: 0.9736842105263158.
Trial 19 finished with value: 0.5789473684210527 and parameters: {'momentum': 0.6342331714736982}. Best is trial 12 with value: 0.9736842105263158.
Trial 20 finished with value: 0.5789473684210527 and parameters: {'momentum': 0.6245382660245355}. Best is trial 12 with value: 0.9736842105263158.
Trial 21 finished with value: 0.9736842105263158 and parameters: {'momentum': 0.9910833366471181}. Best is trial 12 with value: 0.9736842105263158.
Trial 22 finished with value: 0.6842105263157895 and parameters: {'momentum': 0.8511989216863185}. Best is trial 12 with value: 0.9736842105263158.
Trial 23 finished with value: 0.7105263157894737 and parameters: {'momentum': 0.8651430221657904}. Best is trial 12 with value: 0.9736842105263158.
Trial 24 finished with value: 0.9736842105263158 and parameters: {'momentum': 0.9861195378303332}. Best is trial 12 with value: 0.9736842105263158.
Trial 25 finished with value: 0.5789473684210527 and parameters: {'momentum': 0.7038643885831284}. Best is trial 12 with value: 0.9736842105263158.
Trial 26 finished with value: 0.7631578947368421 and parameters: {'momentum': 0.8839270551219995}. Best is trial 12 with value: 0.9736842105263158.
Trial 27 finished with value: 0.9736842105263158 and parameters: {'momentum': 0.9887545050398467}. Best is trial 27 with value: 0.9736842105263158.
Trial 28 finished with value: 0.6052631578947368 and parameters: {'momentum': 0.8104918434458502}. Best is trial 27 with value: 0.9736842105263158.
Trial 29 finished with value: 0.7894736842105263 and parameters: {'momentum': 0.8966504740666983}. Best is trial 27 with value: 0.9736842105263158.
8852156}. Best is trial 1 with value: 0.868421052631579.
Trial 3 finished with value: 0.5526315789473685 and parameters: {'momentum': 0.3811023910622675}. Best is trial 1 with value: 0.868421052631579.
Trial 4 finished with value: 0.39473684210526316 and parameters: {'momentum': 0.3067986499189541}. Best is trial 1 with value: 0.868421052631579.
Trial 5 finished with value: 0.5789473684210527 and parameters: {'momentum': 0.5027304944198423}. Best is trial 1 with value: 0.868421052631579.
Trial 6 finished with value: 0.5 and parameters: {'momentum': 0.35407528476620276}. Best is trial 1 with value: 0.868421052631579.
Trial 7 finished with value: 0.5789473684210527 and parameters: {'momentum': 0.7845717468291608}. Best is trial 1 with value: 0.868421052631579.
Trial 8 finished with value: 0.23684210526315788 and parameters: {'momentum': 0.11950547138775147}. Best is trial 1 with value: 0.868421052631579.
Trial 9 finished with value: 0.23684210526315788 and parameters: {'momentum': 0.11064609416531002}. Best is trial 1 with value: 0.868421052631579.
Trial 10 finished with value: 0.8947368421052632 and parameters: {'momentum': 0.9345689933872496}. Best is trial 10 with value: 0.8947368421052632.
Trial 11 finished with value: 0.9473684210526315 and parameters: {'momentum': 0.9668857072541637}. Best is trial 11 with value: 0.9473684210526315.
Trial 12 finished with value: 0.9736842105263158 and parameters: {'momentum': 0.9866805172498223}. Best is trial 12 with value: 0.9736842105263158.
Trial 13 finished with value: 0.5789473684210527 and parameters: {'momentum': 0.7512445222870912}. Best is trial 12 with value: 0.9736842105263158.
Trial 14 finished with value: 0.5789473684210527 and parameters: {'momentum': 0.7579903663952012}. Best is trial 12 with value: 0.9736842105263158.
Trial 15 finished with value: 0.9473684210526315 and parameters: {'momentum': 0.9599449532382308}. Best is trial 12 with value: 0.9736842105263158.
Trial 16 finished with value: 0.5789473684210527 and parameters: {'momentum': 0.6406057467785957}. Best is trial 12 with value: 0.9736842105263158.
Trial 17 finished with value: 0.6842105263157895 and parameters: {'momentum': 0.8465535973043425}. Best is trial 12 with value: 0.9736842105263158.
Trial 18 finished with value: 0.9736842105263158 and parameters: {'momentum': 0.9975536620250329}. Best is trial 12 with value: 0.9736842105263158.
Trial 19 finished with value: 0.5789473684210527 and parameters: {'momentum': 0.6342331714736982}. Best is trial 12 with value: 0.9736842105263158.
Trial 20 finished with value: 0.5789473684210527 and parameters: {'momentum': 0.6245382660245355}. Best is trial 12 with value: 0.9736842105263158.
Trial 21 finished with value: 0.9736842105263158 and parameters: {'momentum': 0.9910833366471181}. Best is trial 12 with value: 0.9736842105263158.
Trial 22 finished with value: 0.6842105263157895 and parameters: {'momentum': 0.8511989216863185}. Best is trial 12 with value: 0.9736842105263158.
Trial 23 finished with value: 0.7105263157894737 and parameters: {'momentum': 0.8651430221657904}. Best is trial 12 with value: 0.9736842105263158.
Trial 24 finished with value: 0.9736842105263158 and parameters: {'momentum': 0.9861195378303332}. Best is trial 12 with value: 0.9736842105263158.
Trial 25 finished with value: 0.5789473684210527 and parameters: {'momentum': 0.7038643885831284}. Best is trial 12 with value: 0.9736842105263158.
Trial 26 finished with value: 0.7631578947368421 and parameters: {'momentum': 0.8839270551219995}. Best is trial 12 with value: 0.9736842105263158.
Trial 27 finished with value: 0.9736842105263158 and parameters: {'momentum': 0.9887545050398467}. Best is trial 27 with value: 0.9736842105263158.
Trial 28 finished with value: 0.6052631578947368 and parameters: {'momentum': 0.8104918434458502}. Best is trial 27 with value: 0.9736842105263158.
Trial 29 finished with value: 0.7894736842105263 and parameters: {'momentum': 0.8966504740666983}. Best is trial 27 with value: 0.9736842105263158.
omentum': 0.6342331714736982}. Best is trial 12 with value: 0.9736842105263158.
Trial 20 finished with value: 0.5789473684210527 and parameters: {'momentum': 0.6245382660245355}. Best is trial 12 with value: 0.9736842105263158.
Trial 21 finished with value: 0.9736842105263158 and parameters: {'momentum': 0.9910833366471181}. Best is trial 12 with value: 0.9736842105263158.
Trial 22 finished with value: 0.6842105263157895 and parameters: {'momentum': 0.8511989216863185}. Best is trial 12 with value: 0.9736842105263158.
Trial 23 finished with value: 0.7105263157894737 and parameters: {'momentum': 0.8651430221657904}. Best is trial 12 with value: 0.9736842105263158.
Trial 24 finished with value: 0.9736842105263158 and parameters: {'momentum': 0.9861195378303332}. Best is trial 12 with value: 0.9736842105263158.
Trial 25 finished with value: 0.5789473684210527 and parameters: {'momentum': 0.7038643885831284}. Best is trial 12 with value: 0.9736842105263158.
Trial 26 finished with value: 0.7631578947368421 and parameters: {'momentum': 0.8839270551219995}. Best is trial 12 with value: 0.9736842105263158.
Trial 27 finished with value: 0.9736842105263158 and parameters: {'momentum': 0.9887545050398467}. Best is trial 27 with value: 0.9736842105263158.
Trial 28 finished with value: 0.6052631578947368 and parameters: {'momentum': 0.8104918434458502}. Best is trial 27 with value: 0.9736842105263158.
Trial 29 finished with value: 0.7894736842105263 and parameters: {'momentum': 0.8966504740666983}. Best is trial 27 with value: 0.9736842105263158.
omentum': 0.6342331714736982}. Best is trial 12 with value: 0.9736842105263158.
Trial 20 finished with value: 0.5789473684210527 and parameters: {'momentum': 0.6245382660245355}. Best is trial 12 with value: 0.9736842105263158.
Trial 21 finished with value: 0.9736842105263158 and parameters: {'momentum': 0.9910833366471181}. Best is trial 12 with value: 0.9736842105263158.
Trial 22 finished with value: 0.6842105263157895 and parameters: {'momentum': 0.8511989216863185}. Best is trial 12 with value: 0.9736842105263158.
Trial 23 finished with value: 0.7105263157894737 and parameters: {'momentum': 0.8651430221657904}. Best is trial 12 with value: 0.9736842105263158.
Trial 24 finished with value: 0.9736842105263158 and parameters: {'momentum': 0.9861195378303332}. Best is trial 12 with value: 0.9736842105263158.
Trial 25 finished with value: 0.5789473684210527 and parameters: {'momentum': 0.7038643885831284}. Best is trial 12 with value: 0.9736842105263158.
Trial 26 finished with value: 0.7631578947368421 and parameters: {'momentum': 0.8839270551219995}. Best is trial 12 with value: 0.9736842105263158.
Trial 27 finished with value: 0.9736842105263158 and parameters: {'momentum': 0.9887545050398467}. Best is trial 27 with value: 0.9736842105263158.
Trial 28 finished with value: 0.6052631578947368 and parameters: {'momentum': 0.8104918434458502}. Best is trial 27 with value: 0.9736842105263158.
Trial 29 finished with value: 0.7894736842105263 and parameters: {'momentum': 0.8966504740666983}. Best is trial 27 with value: 0.9736842105263158.
omentum': 0.6342331714736982}. Best is trial 12 with value: 0.9736842105263158.
Trial 20 finished with value: 0.5789473684210527 and parameters: {'momentum': 0.6245382660245355}. Best is trial 12 with value: 0.9736842105263158.
Trial 21 finished with value: 0.9736842105263158 and parameters: {'momentum': 0.9910833366471181}. Best is trial 12 with value: 0.9736842105263158.
Trial 22 finished with value: 0.6842105263157895 and parameters: {'momentum': 0.8511989216863185}. Best is trial 12 with value: 0.9736842105263158.
Trial 23 finished with value: 0.7105263157894737 and parameters: {'momentum': 0.8651430221657904}. Best is trial 12 with value: 0.9736842105263158.
Trial 24 finished with value: 0.9736842105263158 and parameters: {'momentum': 0.9861195378303332}. Best is trial 12 with value: 0.9736842105263158.
Trial 25 finished with value: 0.5789473684210527 and parameters: {'momentum': 0.7038643885831284}. Best is trial 12 with value: 0.9736842105263158.
Trial 26 finished with value: 0.7631578947368421 and parameters: {'momentum': 0.8839270551219995}. Best is trial 12 with value: 0.9736842105263158.
Trial 27 finished with value: 0.9736842105263158 and parameters: {'momentum': 0.9887545050398467}. Best is trial 27 with value: 0.9736842105263158.
Trial 28 finished with value: 0.6052631578947368 and parameters: {'momentum': 0.8104918434458502}. Best is trial 27 with value: 0.9736842105263158.
Trial 29 finished with value: 0.7894736842105263 and parameters: {'momentum': 0.8966504740666983}. Best is trial 27 with value: 0.9736842105263158.
alue: 0.868421052631579.
Trial 3 finished with value: 0.5526315789473685 and parameters: {'momentum': 0.3811023910622675}. Best is trial 1 with value: 0.868421052631579.
Trial 4 finished with value: 0.39473684210526316 and parameters: {'momentum': 0.3067986499189541}. Best is trial 1 with value: 0.868421052631579.
Trial 5 finished with value: 0.5789473684210527 and parameters: {'momentum': 0.5027304944198423}. Best is trial 1 with value: 0.868421052631579.
Trial 6 finished with value: 0.5 and parameters: {'momentum': 0.35407528476620276}. Best is trial 1 with value: 0.868421052631579.
Trial 7 finished with value: 0.5789473684210527 and parameters: {'momentum': 0.7845717468291608}. Best is trial 1 with value: 0.868421052631579.
Trial 8 finished with value: 0.23684210526315788 and parameters: {'momentum': 0.11950547138775147}. Best is trial 1 with value: 0.868421052631579.
Trial 9 finished with value: 0.23684210526315788 and parameters: {'momentum': 0.11064609416531002}. Best is trial 1 with value: 0.868421052631579.
Trial 10 finished with value: 0.8947368421052632 and parameters: {'momentum': 0.9345689933872496}. Best is trial 10 with value: 0.8947368421052632.
Trial 11 finished with value: 0.9473684210526315 and parameters: {'momentum': 0.9668857072541637}. Best is trial 11 with value: 0.9473684210526315.
Trial 12 finished with value: 0.9736842105263158 and parameters: {'momentum': 0.9866805172498223}. Best is trial 12 with value: 0.9736842105263158.
Trial 13 finished with value: 0.5789473684210527 and parameters: {'momentum': 0.7512445222870912}. Best is trial 12 with value: 0.9736842105263158.
